"expediente","producto","titular","registrosanitario","fechaexpedicion","fechavencimiento","estadoregistro","expedientecum","consecutivocum","cantidadcum","descripcioncomercial","estadocum","fechaactivo","fechainactivo","muestramedica","unidad","atc","descripcionatc","viaadministracion","concentracion","principioactivo","unidadmedida","cantidad","unidadreferencia","formafarmaceutica","nombrerol","tiporol","modalidad","IUM","preciocompra","precioventa"
"4098","CEBION®500MG TABLETAS MASTICABLES","PROCTER & GAMBLE COLOMBIA LTDA","INVIMA 2016M- 0007923-R3","1995-08-11",,"Vigente","4098","1","30","CAJA DISPENSADORA POR 30 TABLETAS EN TIRAS DE PAPEL POUCH/POLIETILENO/ALUMINIO POLIETILENO (FOIL) POR 10 TABLETAS","Activo","2006-11-10",,"No","U","A11GA01","ACIDO ASCORBICO (VIT C)","ORAL","A","ACIDO ASCORBICO 260MG +ASCORBATO DE SODIO 290MGEQUIVALENTES A VITAMINA C","No","500","TABLETA MASTICABLE","TABLETA MASTICABLE","ALTEA FARMACEUTICA S.A.","FABRICANTE","FABRICAR Y VENDER",,"1274","2653"
"16478","OMEPRAZOL 20 MG","GENFAR S.A","INVIMA 2020M-007243-R2","1999-01-01",,"Vigente","16478","1","10","CAJA X 10 CAPSULAS EN BLISTER ALUMINIO/ PVC- PVDCSIN DATOPOR 10 CAPSULAS CADA BLISTER..","Activo","2006-11-10",,"No","U","A02BC01","OMEPRAZOL","ORAL","A","OMEPRAZOL PELLETS 8.5% (EQUIVALENTE ADE OMEPRAZOL BASE)","No","20","CAPSULA","CAPSULA DURA","FAREVA VILLA RICA S.A.S.","FABRICANTE","IMPORTAR. SEMIELABORAR Y VENDER",,"1325","2827"
"21013","FYBOGEL® GRANULOS","RB (HEALTH) COLOMBIA S.A.S","INVIMA 2016M-006811-R3","1999-01-01",,"Vigente","21013","1","6","CAJA PLEGADIZA CON 6SIN DATOFOIL DE ALUMINIO (SACHET INDIVIDUAL) POR 3.5G DE ISPAGHULA HUSK CADA UNO.","Activo","2006-11-10",,"No","U","A06AC01","ISPAGULA (PSYLLA SEMILLAS)","ORAL","E","ISPAGHULA HUSK","No","79.618","100 GRAMOS","GRANULOS","RB (HEALTH) COLOMBIA S.A.S","IMPORTADOR","IMPORTAR Y VENDER",,"5106","11346"
"21740","VITAMINA C GOTAS 100MG/ML","LABORATORIOS ECAR S.A.","INVIMA 2020M-007156-R3","1999-01-01",,"Vigente","21740","2","50","CAJA PLEGADIZA X FRASCO DE VIDRIO AMBAR POR 50 ML. CON GOTERO DE PLASTICO","Activo","2006-11-10",,"No","ml","A11GA01","ACIDO ASCORBICO (VIT C)","ORAL","B","ACIDO ASCORBICO 76.1 MG + ASCORBATO DE SODIO 35.0 MGEQUIVALENTES A VITAMINA C","No","100","ML.(20 GOTAS APROX.)","SOLUCION ORAL","LABORATORIOS ECAR S.A.","FABRICANTE","FABRICAR Y VENDER",,"4391","9271"
"13358","VENOFER INYECTABLE.","VIFOR INTERNATIONAL INC","INVIMA 2018M-006989-R2","1999-01-01",,"Vigente","13358","2","5","AMPOLLA DE VIDRIO TIPO I. INCOLORA DE 5 ML. EN CAJA POR 1 AMPOLLA EN BLISTER PLASTICO.","Activo","2006-11-10",,"No","ml","B03AC02","HIERRO OXIDO SACARATADO","INTRAVENOSA","A","HIERRO COMO (HIERRO SACARATO (HIERRO III-COMPLEJO DE HIDROXIDO SUCROSA)","No","100","AMPOLLA DE 5 ML","SOLUCION INYECTABLE","FARMA DE COLOMBIA S.A.S.","IMPORTADOR","IMPORTAR Y VENDER",,"13355","31161"
"23282","DIANEAL PD- 2 CON DEXTROSAAL 2.5%","LABORATORIOS BAXTER S.A.","IINVIMA 2023M-007582-R4","1996-12-17","3000-01-01","Vigente","23282","1","250","BOLSAS PLÁSTICAS PVC GRADO MÉDICO X 250ML. CON BOLSA EXTERNA EN PEAD.","Activo","2006-11-10","2023-09-14","No","ml","B05DA99","SOLUCIONES ISOTONICAS","INTRAPERITONEAL","B","CLORURO DE CALCIO DIHIDRATADO","No","25.7","100ML","SOLUCION ESTERIL PARA DIÁLISIS PERITONEAL","LABORATORIOS BAXTER S.A.","FABRICANTE","FABRICAR Y VENDER",,"3880","8191"
"25653","HERREX ® JARABE","FARMA DE COLOMBIA S.A.S.","INVIMA 2020M-009945-R3","1999-01-01",,"Vigente","25653","1","1","FRASCO DE VIDRIO COLOR AMBAR TAPA PILFER PROF POR 30 ML EN CAJA CARTULINA PVC","Activo","2006-11-10",,"No","U","B03AB04","FERRICO HIDROXIDO","ORAL","B","COMPLEJO NO IONICO DEHIDROXIDO FERRICO POLIMALTOSADO (AMYLOFER 25%) EQUIVALENTE A HIERRO III","No","1","100 ML DE JARABE","JARABE","ALTEA FARMACEUTICA S.A.","FABRICANTE","FABRICAR Y VENDER",,"7619","17620"
"32623","ACIDO FOLICO TABLETAS 5MG","LABORATORIOS ECAR S.A.","INVIMA 2008 M-010389 R2","1999-01-01",,"Vigente","32623","6","10","CAJA PLEGADIZA POR 10 TABLETAS EN BLISTER PVC/ALUMINIO POR 10 TABLETAS","Activo","2008-09-09",,"No","U","B03BB01","FOLICO ACIDO","ORAL","A","ACIDO FOLICO","No","0.005","TABLETA CONTIENE","TABLETA","LABORATORIOS ECAR S.A.","FABRICANTE","FABRICAR Y VENDER",,"1029","2143"
"9813","HIDROCLOROTIAZIDA 25 MG TABLETAS","MEMPHIS PRODUCTS S.A.","INVIMA 2016M-002326-R2","1995-07-14",,"Vigente","9813","3","10","CAJA POR 10 TABLETAS EN BLISTER PVC TRANSPARENTE / ALUMINIO POR 10 TABLETAS.","Activo","2006-11-10",,"No","U","C03AA03","HIDROCLOROTIAZIDA","ORAL","A","HIDROCLOROTIAZIDA","No","25","TABLETA","TABLETA","COLOMPACK S.A.","FABRICANTE","FABRICAR Y VENDER",,"1220","2542"
"20526","PROCICAR® CREMA","MEGALABS COLOMBIA S.A.S","INVIMA 2019M-009074-R3","1999-01-01",,"Vigente","20526","2","30","TUBO COLAPSIBLE X 30 G TAPA CON LINNER DESIN DATODOS CAPAS:POLIETILENO/ AL ADHERIDO A LA TAPA DEL TUBO","Activo","2006-11-10",,"No","g","C05AX04","ZINC PREPARACIONES","TOPICA (EXTERNA)","D","CALAMINA (OXIDO DE ZINC: 5G + ARIABEL SIENNA: 0.02G)","No","5","100 G","CREMA TOPICA","ALTEA FARMACEUTICA S.A.","FABRICANTE","FABRICAR Y VENDER",,"7265","16766"
"26775","VASOTON GEL.","FARMACOL CHINOIN S.A.S..","INVIMA 2008 M-011596 R1","1998-09-08","3000-12-31","Vigente","26775","1","40","CAJA POR UN TUBO COLAPSIBLE DE PEBD CON TAPA DE PP POR 40 G","Activo","2006-11-10",,"No","g","C05BA51","HEPARINOIDE COMBINACIONES","TOPICA (EXTERNA)","D","AESCINA","No","1","100 G","GEL TOPICO","FARMACOL CHINOIN S.A.S..","FABRICANTE","FABRICAR Y VENDER",,"7531","17415"
"27612","PROSTIN VR PEDIÁTRICO SOLUCIÓN INYECTABLE","PFIZER S.A.S.","INVIMA 2019M-009439-R3","1997-04-17",,"Vigente","27612","1","5","CAJA DE CARTON CON 5 AMPOLLETAS DE 1 ML.","Activo","2006-11-10",,"No","ml","C01EA01","ALPROSTADIL","INTRAVENOSA","A","ALPROSTADIL","No","0.5","AMPOLLA DE 1 ML","SOLUCION INYECTABLE","PFIZER MANUFACTURING BELGIUM NV","FABRICANTE","IMPORTAR Y VENDER",,"11772","27467"
"7028","BIODERM® CREMA","LABORATORIOS SIEGFRIED S.A.S.","INVIMA 2023M-005385-R3","1999-01-01",,"Vigente","7028","2","20","CAJA CON TUBO COLAPSIBLE DE ALUMINIO CON RECUBRIMIENTO INTERIOR DE RESINA EPOXIFENOLICA POR 20G","Activo","2006-11-10",,"No","g","D07CB04","DEXAMETASONA Y ANTIBIOTICOS","TOPICA (EXTERNA)","D","DEXAMETASONA","No","0.04","100 G DE CREMA","CREMA TOPICA","LABORATORIOS SIEGFRIED S.A.S.","FABRICANTE","FABRICAR Y VENDER",,"7392","17060"
"19547","UNGÜENTO MENTOL NO. 2®","TECNOFAR TQ S.A.S","INVIMA 2022M-006295-R4","1994-06-08","3000-01-01","Vigente","19547","1","50","POTE PLÁSTICO DE POLIPROPILENO CON TAPA DE POLIPROPILENO POR 50 G.","Activo","2006-11-10",,"No","g","D11AX97","MENTOL. ALCANFOR. SALICILATO DE METILO","TOPICA (EXTERNA)","D","ALCANFOR SINTÉTICO","No","3","100 G DE UNGÜENTO","UNGUENTO TOPICO","TECNOFAR TQ S.A.S","FABRICANTE","FABRICAR Y VENDER",,"5296","9003"
"24342","MERTHIOLATE INCOLORO (TINTURA)","TECNOFAR TQ S.A.S","INVIMA 2021M-007872-R4","1995-08-17",,"Vigente","24342","4","90","FRASCO POR 90 ML. EN FRASCO DE POLIETILENO DE ALTA DENSIDAD PIGMENTADO BLANCO","Activo","2006-11-10",,"No","ml","D08AK06","TIOMERSAL","TOPICA (EXTERNA)","B","THIMEROSAL","No","0.1","100 ML.","SOLUCION TOPICA","TECNOFAR TQ S.A.S","FABRICANTE","FABRICAR Y VENDER",,"4306","9091"
"28014","CONDILOM SUSPENSION","LABORATORIOS BUSSIÉ S.A.","INVIMA 2009 M-000476-R3","1998-04-02",,"Vigente","28014","1","5","FRASCO PLASTICO PEAD POR 5 ML EN CAJA PLEGADIZA","Activo","2006-11-10",,"No","ml","D06BB04","PODOFILOTOXINA","TOPICA (EXTERNA)","B","PODOFILINA HEXANDRUM","No","20","100 ML DE SUSPENSION","SUSPENSION TOPICA","LABORATORIOS BUSSIE S.A.","FABRICANTE","FABRICAR Y VENDER",,"9711","22488"
"13854","CYCLOFEM","ASOCIACIÓN PROFAMILIA","INVIMA 2007M-006325-R1","1997-04-17",,"Vigente","13854","1","1","CAJA POR UNA AMPOLLA DE 0.5 ML.","Activo","2006-11-10",,"No","U","G03AA17","MEDROXIPROGESTERONA + ESTRADIOL","INTRAMUSCULAR","A","ACETATO DE MEDROXIPROGESTERONA","No","25","AMPOLLA","SUSPENSION INYECTABLE","ASOCIACIÓN PROFAMILIA","IMPORTADOR","IMPORTAR Y VENDER",,"9321","21585"
"21475","FENILSONE®","LABORATORIO FRANCO COLOMBIANO - LAFRANCOL S.A.S.","INVIMA 2021M-002376-R3","1995-07-15",,"Vigente","21475","1","1","TUBO COLAPSIBLE PLASTICOSIN DATODE 20SIN DATOG EN ESTUCHE INDIVIDUAL CON 6 APLICADORES LOS REGISTROS SANITARIOS DE LOS APLICADORES SON: 2009DM-0004277. 2010DM-0006261. 2010DM-0006639.SIN DATO2011DM-0006995 O INVIMA 2021DM-0024703SIN DATOAPLICADOR VAGINAL DEL PROVEEDOR PROENFAR S.A.S","Activo","2006-11-10",,"No","U","G01AF02","CLOTRIMAZOL","VAGINAL","D","CLOTRIMAZOL","No","1","100 G DE CREMA","CREMA VAGINAL","LABORATORIO FRANCO COLOMBIANO - LAFRANCOL S.A.S.","FABRICANTE","FABRICAR Y VENDER",,"7349","16960"
"21776","PROVERA 5MG TABLETAS","PFIZER S.A.S.","INVIMA 2021M-008808-R4","1995-08-27",,"Vigente","21776","2","30","CAJA POR 30 TABLETAS EN BLISTER ALUMINIO / PVC TRANSPARENTE.","Activo","2006-11-10",,"No","U","G03AC06","MEDROXIPROGESTERONA","ORAL","A","MEDROXIPROGESTERONA ACETATO","No","5","TABLETA","TABLETA","PFIZER ITALIA S.R.L","FABRICANTE","IMPORTAR Y VENDER",,"1045","2176"
"31279","TESTOVIRON® DEPOT POR 250 MG","BAYER A.G.","INVIMA 2023M-001042-R5","1998-07-29","3000-01-01","Vigente","31279","1","1","CAJA POR 1 AMPOLLA DE VIDRIO INCOLORO TIPO I CON 1 ML. CON CÓDIGO COLOR Y TAPÓN EN EL EXTREMO DE ESTIRENO-BUTADIENO GRIS (4404). CON ÉMBOLO DE BROMOBUTILO GRIS OSCURO OSCURO","Activo","2006-11-10",,"No","ml","G03BA03","TESTOSTERONA","INTRAMUSCULAR","A","ENANTATO DE TESTOSTERONA","No","250","AMPOLLA DE 1ML","SOLUCION INYECTABLE","BAYER DE MÉXICO S.A DE C.V","FABRICANTE","IMPORTAR Y VENDER",,"13500","31499"
"20600","PREDNISOLONA 5 MG","TECNOQUIMICAS S.A. (PLANTA YUMBO)","INVIMA 2020M-006044-R3","1999-01-01",,"Vigente","20600","1","30","CAJA PLEGADIZA POR 30 TABLETAS EN BLISTER PVC / ALUMINIO POR 10 TABLETAS CADA UNO","Activo","2006-11-10",,"No","U","H02AB06","PREDNISOLONA","ORAL","A","PREDNISOLONA","No","5","TABLETA","TABLETA","TECNOQUIMICAS S.A. (PLANTA JAMUNDI)","FABRICANTE","FABRICAR Y VENDER",,"1130","2355"
"28346","DUO-DECADRON SUSPENSION INYECTABLE POR 2ML","TECNOQUIMICAS S.A.","INVIMA 2021M-010674-R2","1999-02-18",,"Vigente","28346","1","1","CAJA XSIN DATO1 AMPOLLA DE VIDRIO TIPO ISIN DATOTRANSPARENTESIN DATO CONSIN DATO2 ML/ AMPOLLA","Activo","2006-11-10",,"No","U","H02AB02","DEXAMETASONA","INTRA-ARTICULAR","A","DEXAMETASONA ACETATO. EQUIVALENTE A DEXAMETASONA BASE","No","16","AMPOLLA DE2 ML.","SUSPENSION INYECTABLE","LABORATORIOS RYAN DE COLOMBIA S.A.S.","FABRICANTE","FABRICAR Y VENDER",,"10305","23865"
"33903","SYNTOCINON® DE 10 U.I. AMPOLLAS","MYLAN PHARMA GMBH","INVIMA 2019M-002269-R4","1999-09-08","3000-01-01","Vigente","33903","1","100","CAJA DE CARTON 100 AMPOLLAS DE VIDRIO TIPO I DE 1 ML","Activo","2006-11-10","2018-12-26","No","U","H01BB02","OXITOCINA","INFUSIÓN INTRAVENOSA","A","OXITOCINA CON ACTIVIDAD MEDIA DE 200UI/ML -CORRESPONDE A","No","10","AMPOLLA DE 1 ML","SOLUCION INYECTABLE","NOVARTIS PHARMA STEINAG. PHARMACEUTICAL OPERATIONS SCHEWEIZ SOLIDS","FABRICANTE","IMPORTAR Y VENDER",,"10511","24526"
"19979333","MINIRIN MELT 120 µG","FERRING PHARMACEUTICALS LTD.","INVIMA 2019M-0007827-R1","2008-03-06",,"Vigente","19979333","1","10","CAJA POR 10 LIOFILIZADOS EN 1 BLISTER POR 10 LIOFILIZADOS ORALES.","Activo","2007-08-02",,"No","U","H01BA02","DESMOPRESINA","ORAL","D","DESMOPRESINA ACETATO EQUIVALENTE A 120 µG DE DESMOPRESINA","No","120","LIOFILIZADO ORAL","LIOFILIZADO ORAL DE DISPERSION RAPIDA","CATALENT U.K. SWINDON ZYDIS LIMITED","FABRICANTE","IMPORTAR Y VENDER",,"5585","9495"
"6411","AZITROMICINA 500MG.","TECNOQUIMICAS S.A.","INVIMA 2022M-005294-R3","1996-08-15",,"Vigente","6411","2","3","CAJA POR 3 TABLETAS EN BLISTER PVC / ALUMINIO","Activo","2006-11-10",,"No","U","J01FA10","AZITROMICINA","ORAL","A","AZITROMICINA DIHIDRATO. EQUIVALENTE A AZITROMICINA BASE","No","500","TABLETACUBIERTA","TABLETA CUBIERTA CON PELICULA","TECNOQUIMICAS S.A. PLANTA JAMUNDI","FABRICANTE","FABRICAR Y VENDER",,"1044","2176"
"6414","AZITROMICINA MK 200 MG/ 5 ML POLVO PARA SUSPENSION","TECNOQUIMICAS S.A.","INVIMA 2022M-002588-R3","1999-01-01",,"Vigente","6414","3","1","CAJA PLEGADIZA CON FRASCO PEAD NATURAL. TAPA DE PP BLANCA. FRASCO PEAD NATURAL TAPA BLANCA DE PP CON DILUENTE. MÁS JERINGA DOSIFICADORA. TAPÓN DE SEGURIDAD E INSTRUCTIVO DE USO.","Activo","2019-12-19",,"No","U","J01FA10","AZITROMICINA","ORAL","E","AZITROMICINA DIHIDRATOEQUIVALENTE A AZITROMICINA ANHIDRA.","No","4","70 G DE POLVO PARA RECONSTITUIR A 100ML","POLVO PARA RECONSTITUIR A SUSPENSION ORAL","TECNOFAR TQ S.A.S","FABRICANTE","FABRICAR Y VENDER",,"10708","24798"
"16806","CLINDAMICINA CAPSULAS 300 MG.","LABORATORIOS LA SANTÉ S.A.","INVIMA 2022M-003918-R3","1999-01-01",,"Vigente","16806","1","24","CAJA POR 24 CAPSULAS EN BLISTER PVC TRANSPARENTE/ALUMINIO.","Activo","2006-11-10",,"No","U","J01FF01","CLINDAMICINA","ORAL","A","CLINDAMICINA CLORHIDRATO MONOHIDRATO EQUIVALENTE A CLINDAMICINA BASE","No","300","CÁPSULA","CAPSULA DURA","LABORATORIOS LA SANTÉ S.A.","FABRICANTE","FABRICAR Y VENDER",,"1638","3495"
"19237","RETROVIR IV PARA INFUSION","GLAXOSMITHKLINE COLOMBIA S.A","INVIMA 2017M-005247-R2","1996-07-21",,"Vigente","19237","2","5","CAJA POR 5 FRASCOS VIAL X 20 ML.","Activo","2006-11-10",,"No","U","J05AF01","ZIDOVUDINA","INFUSIÓN INTRAVENOSA","A","ZIDOVUDINA","No","200","CADA VIAL DE 20 ML CON SOLUCION INYECTABLE","SOLUCION INYECTABLE","GLAXO WELLCOME OPERATIONS","FABRICANTE","IMPORTAR Y VENDER",,"11724","27356"
"21531","ENDOXAN ® GRAGEAS 50 MG","BAXTER DEUTSCHLAND GMBH (BDG)","INVIMA 2022M-008010-R4","1995-11-23",,"Vigente","21531","1","50","PRESENTACION COMERCIAL: CAJA PLEGADIZA DE CARTULINA CON 5 BLÍSTER DE PVC/PVDC/ALUMINIO POR 10 GRAGEAS CADA BLÍSTER.","Activo","2006-11-10",,"No","U","L01AA01","CICLOFOSFAMIDA","ORAL","A","CICLOFOSFAMIDA MONOHIDRATO EQUIVALENTE ACICLOFOSFAMIDA BASE","No","50","GRAGEA","TABLETA CUBIERTA (GRAGEA)","HAUPT PHARMA AMAREG. GMBH","FABRICANTE","IMPORTAR Y VENDER",,"1344","2800"
"21534","ENDOXAN 500 MG","BAXTER DEUTSCHLAND GMBH (BDG)","INVIMA 2022M-008011-R4","1995-11-28",,"Vigente","21534","1","1","VIAL DE VIDRIO TIPO I POR 500 MG.","Activo","2006-11-10",,"No","U","L01AA01","CICLOFOSFAMIDA","INTRAVENOSA","A","CICLOFOSFAMIDA MONOHIDRATO EQUIVALENTE A CICLOFOSFAMIDA","No","500","VIAL","POLVO ESTERIL PARA RECONSTITUIR A SOLUCION INYECTABLE","BAXTER ONCOLOGY GMBH","FABRICANTE","IMPORTAR Y VENDER",,"11341","26463"
"22899","SANDIMMUN NEORAL MICROEMULSION","NOVARTIS PHARMA AG","INVIMA 2022M-007777-R3","1997-09-16",,"Vigente","22899","2","1","CAJA FRASCO DE VIDRIO ÁMBAR HIDROLÍTICO TIPO III 50 ML CON TAPÓN DE GOMA BROMOBUTILO Y TAPÓN DE ALUMINIO TIPO TEAR-OFF DESPRENDIBLE. CON TAPA ROSCA.","Activo","2021-07-09",,"No","U","L04AD01","CICLOSPORINA","ORAL","B","CICLOSPORINA A","No","10","100 ML DE EMULSION","EMULSION ORAL","DELPHARM HUNINGUE S.A.S.","FABRICANTE","IMPORTAR Y VENDER",,"4388","7459"
"27207","VESANOID® 10 MG.","CHEPLAPHARM ARZNEIMITTEL GMBH","INVIMA 2022M-004250-R3","1996-02-24",,"Vigente","27207","1","100","CAJA POR UN FRASCO DE VIDRIO COLOR ÁMBAR POR 100 CÁPSULAS BLANDAS.","Activo","2006-11-10",,"No","U","L01XX14","TRETINOIN","ORAL","A","TRETINOINA","No","10","CAPSULA BLANDA","CAPSULA BLANDA","CATALENT GERMANY EBERBACH GMBH","FABRICANTE","IMPORTAR Y VENDER",,"1497","3193"
"9812","METOCARBAMOL TABLETAS 750 MG","MEMPHIS PRODUCTS S.A.","INVIMA 2016 M-002325-R2","1995-07-15",,"Vigente","9812","3","10","CAJA POR 10 TABLETAS EN ENVASE BLISTER ALUMINIO/PVC (INCOLORO).","Activo","2006-11-10",,"No","U","M03BA03","METOCARBAMOL","ORAL","A","METOCARBAMOL","No","750","TABLETA","TABLETA","CLARIPACK S.A.","FABRICANTE","FABRICAR Y VENDER",,"1263","2630"
"11699","KETOPROFENO GEL","GENFAR S.A","INVIMA 2022M-011174-R2","1999-01-01",,"Vigente","11699","2","1","CAJA CON TUBO COLAPSIBLE DE ALUMINIO Y TAPA EN POLIPROPILENO POR 60 G","Activo","2006-11-10",,"No","U","M02AA10","KETOPROFENO","TOPICA (EXTERNA)","D","KETOPROFENO","No","2.5","100 G DE GEL","GEL TOPICO","FAREVA VILLA RICA S.A.S.","FABRICANTE","FABRICAR Y VENDER",,"5682","9659"
"11879","BROMURO DE PANCURONIO 4 MG/2 ML","FEPARVI S.A.S.","INVIMA 2022M-005325-R3","1999-01-01",,"Vigente","11879","1","10","BROMURO DE PANCURONIO 2.0000 MG OTRAS SOLUCIONES INTRAMUSCULAR INTRAVENOSA (FEPARVI) AMPOLLA 2.0000ML / CAJA X 10. CAJA POR 10 AMPOLLAS EN VIDRIO TIPO I POR 2 ML..","Activo","2006-11-10",,"No","U","M03AC01","PANCURONIO","INTRAVENOSA","A","BROMURO DE PANCURONIO","No","4","AMPOLLA POR 2 ML","SOLUCION INYECTABLE","FEPARVI LTDA","IMPORTADOR","IMPORTAR Y VENDER",,"13517","31540"
"27442","PROXIGEL X 20 MG CAPSULAS","EUROFARMA COLOMBIAS.A.S","INVIMA 2019M-009048-R2","2000-03-04",,"Vigente","27442","1","10","CAJA PORSIN DATO 10 CAPSULAS BLANDAS EN EMPAQUE INDIVIDUAL TIPO BLISTER ALUMINIO/PVC-PVDC.","Activo","2006-11-10",,"No","U","M01AC01","PIROXICAM","ORAL","A","PIROXICAM","No","20","CAPSULA","CAPSULA BLANDA","PROCAPS S.A.","FABRICANTE","FABRICAR Y VENDER",,"1654","3528"
"10815","FLUOXETINA 20 MG CÁPSULAS","GENFAR S.A.","INVIMA 2022M-005627-R3","1996-09-26",,"Vigente","10815","1","10","CAJA POR 10 CÁPSULAS EN BLÍSTER PVC TRANSPARENTE / ALUMINIO POR 10 CÁPSULAS CADA UNO.","Activo","2006-11-10",,"No","U","N06AB03","FLUOXETINA","ORAL","A","FLUOXETINA CLORHIDRATO EQUIVALENTE A FLUOXETINA BASE","No","20","CADA CAPSULA DE GELATINA DURA CONTIENE","CAPSULA DURA","FAREVA VILLA RICA S.A.S.","FABRICANTE","FABRICAR Y VENDER",,"1408","3003"
"11416","HALOPERIDOL 10 MG TABLETAS RECUBIERTAS","MEMPHIS PRODUCTS S.A.","INVIMA 2016M-002423-R2","1995-07-15",,"Vigente","11416","2","20","CAJA POR 20 TABLETAS RECUBIERTAS EN BLISTER PVC TRANSPARENTE/ALUMINIO POR 10 TABLETAS CADA UNO.","Activo","2006-11-10",,"No","U","N05AD01","HALOPERIDOL","ORAL","A","HALOPERIDOL","No","10","TABLETA RECUBIERTA","TABLETA RECUBIERTA","COLOMPACK S.A.","FABRICANTE","FABRICAR Y VENDER",,"1145","2386"
"11878","TIOPENTAL 1 G. I V . POLVO PARA SOLUCIÓNINYECTABLE.","FEPARVI S.A.S.","INVIMA 2021M-005982-R2","1996-11-23",,"Vigente","11878","3","1","VIAL DE VIDRIO POR 1 GRAMO TRANSPARENTE DE VIDRIOSIN DATOTIPO III.SIN DATOCON TAPON DE BROMOBUTILO CUBIERTO POR FLUOROPOLIMERO","Activo","2018-09-03",,"No","U","N01AF03","TIOPENTAL","INTRAVENOSA","A","TIOPENTAL SODICO","No","1","CADAVIAL","POLVO ESTERIL PARA RECONSTITUIR A SOLUCION INYECTABLE","FEPARVI S.A.S.","IMPORTADOR","IMPORTAR Y VENDER",,"12684","29596"
"19513","TRAMAL ® GOTAS","GRUNENTHAL GMBH","INVIMA 2014M-007195-R3","1999-01-01",,"Vigente","19513","2","1","CAJA PLEGADIZA CONSIN DATOFRASCO DE VIDRIO AMBAR TIPOSIN DATOIII. CON CUENTA GOTAS DE POLIETILENO DE BAJA DENSIDAD Y TAPA BLANCA DE POLIPROPILENO (EXTERNO)SIN DATOY POLIETILENO (INTERNO) POR 10ML","Activo","2006-11-10",,"No","U","N02AX02","TRAMADOL","ORAL","C","TRAMADOL CLORHIDRATO","No","100","ML","SOLUCION ORAL","GRUNENTHAL COLOMBIANA S.A.","IMPORTADOR","IMPORTAR Y VENDER",,"4993","10540"
"7025","GAMADERM®CHAMPU","LABORATORIOS SIEGFRIED S.A.S.","INVIMA 2017M- 004098-R2","1996-02-09",,"Vigente","7025","1","1","CAJA POR UN FRASCO DE PEAD COLOR NATURAL. TAPA FLIP TOP BLANCA X 60 ML.","Activo","2006-11-10",,"No","U","P03AC04","PERMETRINA","TOPICA (EXTERNA)","B","PERMETRINA","No","1","100 ML","EMULSION (CHAMPOO)","COASPHARMA S.A.S.","FABRICANTE","FABRICAR Y VENDER",,"5619","9552"
"23439","METRONIDAZOL ECAR 500MG TABLETAS","LABORATORIOS ECAR S.A.","INVIMA 2021M-007158-R3","1999-01-01",,"Vigente","23439","1","50","CAJA X 50 TABLETAS EN BLISTER X 10 TABLETAS CADA UNO","Activo","2006-11-10",,"No","U","P01AB01","METRONIDAZOL","ORAL","A","METRONIDAZOL BASE","No","500","TABLETA","TABLETA","LABORATORIOS ECAR S.A.","FABRICANTE","FABRICAR Y VENDER",,"1189","2476"
"25796","PAMOATO DE PIRANTEL SUSPENSION 250 MG/5 ML","GENFAR S.A.","INVIMA 2021M-008265-R4","1995-06-29","3000-01-01","Vigente","25796","2","1","FRASCO PEAD X 15 ML + TAPA EN POLIPROPILENO Y BANDA DE SEGURIDAD","Activo","2021-06-23",,"No","U","P02CC01","PIRANTEL","ORAL","B","PAMOATO DE PIRANTELEQUIVALENTE A PIRANTEL BASE","No","5","100 ML DE SUSPENSIÓN","SUSPENSION ORAL","GENFAR DESARROLLO Y MANUFACTURA S.A.","FABRICANTE","FABRICAR Y VENDER",,"9470","21930"
"36615","METROZIN 500 MG CAPSULAS","LABORATORIOS SIEGFRIED S.A.S.","INVIMA 2017M-003068-R4","1990-12-03",,"Vigente","36615","3","50","CAJA POR 50 CÁPSULAS EN EMPAQUE INDIVIDUAL TIPO BLISTER PVC TRANSPARENTE/FOIL ALUMINIO POR 10 CÁPSULAS BLANDAS C/U.","Activo","2011-05-17",,"No","U","P01AB01","METRONIDAZOL","ORAL","A","METRONIDAZOL BASE","No","500","CAPSULA BLANDA","CAPSULA BLANDA","PROCAPS S.A.","FABRICANTE","FABRICAR Y VENDER",,"1588","3387"
"3521","ALERCET ® JARABE","PROCAPS S.A.","INVIMA 2021M-002103-R3","1999-12-20",,"Vigente","3521","3","1","CAJA CON UN FRASCO DE VIDRIO ÁMBAR TIPO III PORSIN DATO30 ML CONSIN DATOTAPA BLANCA DE ALUMINIO TIPO PILFER PROOF 24MM CONSIN DATOSELLO INTERNO Y CUCHARA DOSIFICADORA.","Activo","2011-02-08",,"No","U","R06AE07","CETIRIZINA","ORAL","B","CETIRIZINA DICLORHIDRATO","No","100","100 ML DE JARABE","JARABE","PROCAPS S.A.","FABRICANTE","FABRICAR Y VENDER",,"8162","18874"
"5581","BRONCHO-VAXOM®CAPSULAS ADULTOS","OM PHARMA SA","INVIMA 2023MB-007838-R4","1999-01-01",,"Vigente","5581","5","10","CAJA POR 10 CÁPSULAS EN BLISTER ALUMINIO/ALUMINIO","Activo","2016-02-04",,"No","U","R07AX03","OTROS PRODUCTOS PARA EL SISTEMA RESPIRATORIO","ORAL","S","LISADOS BACTERIANOS LIOFILIZADOS DE HAEMOPHILUS INFLUENZAE. STREPTOCOCCUS (DIPLOCOCCUS) PNEUMONIAE. KLEBSIELLA PNEUMONIAE SSP PNEUMONIAE Y SSP OZAENAE. STAPHYLOCOCCUS AUREUS. STREPTOCOCCUS PYOGENES Y SANGUINIS (VIRIDANS). MORAXELLA (BRANHAMELLA/NEISSERIA) CATARRHALIS.","No","7","CAPSULA","CAPSULA DURA","AXON PHARMA S.A.S.","IMPORTADOR","IMPORTAR Y VENDER",,"1318","2813"
"9716","B-CORT ® 50","GRÜNENTHAL COLOMBIANA S.A.","INVIMA 2023M-004471-R3","1996-03-14",,"Vigente","9716","3","1","CAJA X 1 FRASCO DE ALU TRATADO EN SU SUPERFICIE CON PLASMA FCP (FLUOROCARBON POLYMER X 10 ML. CON VÁLVULA DOSIFICADORA Y UN ADAPTADOR BUCAL EN PPSIN DATOX 200 DOSIS","Activo","2019-12-18",,"No","U","R03BA02","BUDESONIDA","BUCAL","A","BUDESONIDA MICRONIZADA","No","50","ACTUACIÓN (DOSIS)","AEROSOLES","GRÜNENTHAL COLOMBIANA S.A.","IMPORTADOR","IMPORTAR Y VENDER",,"36968","82386"
"16779","AMBROXOL15 MG/ 5ML SOLUCIÓN ORAL","TECNOFAR TQ S.A.S","INVIMA 2022M-08866-R3","1999-01-01",,"Vigente","16779","1","1","FRASCO DESIN DATOVIDRIO X 120 MLSIN DATOTIPO III.SIN DATOCOLOR ÁMBAR. CONSIN DATOTAPASIN DATOALUSUD 28MMSIN DATOENSIN DATOPOLIPROPILENO BLANCOSIN DATOCONSIN DATOANILLO DE SEGURIDADSIN DATOY LINER EVA AZUL","Activo","2006-11-10",,"No","U","R05CB06","AMBROXOL","ORAL","B","AMBROXOL CLORHIDRATO","No","300","100 ML DE SOLUCIÓN ORAL","SOLUCION ORAL","TECNOFAR TQ S.A.S","FABRICANTE","FABRICAR Y VENDER",,"4156","8773"
"22231","TEARS NATURALE® SOLUCION OFTALMICA ESTERIL","ALCON LABORATORIES INC","INVIMA 2008 M- 007104 R-2","1999-01-01",,"Vigente","22231","3","15","CAJA CON FRASCO GOTERO EN POLIETILENO DE BAJA DENSIDAD POR 15 ML","Activo","2006-11-10",,"No","ml","S01XA20","LAGRIMAS ARTIFICIALES Y OTRAS PREPARACIONES INDIFERENTES","CONJUNTIVAL","C","DEXTRAN 70","No","1","1 ML.","SOLUCION OFTALMICA","ALCON LABORATORIES INC - ASPEX","FABRICANTE","IMPORTAR Y VENDER",,"4704","9931"
"23891","MIOSTAT","ALCON LABORATORIES INC.","INVIMA 2015 M-007598-R3","1995-07-02",,"Vigente","23891","1","18","CAJA POR 12 BLISTER CADA UNO CON UN FRASCO VIAL DE 1.5 ML.","Activo","2006-11-10",,"No","ml","S01EB02","CARBACOL","INTRAOCULAR","A","CARBACOL","No","0.15","VIAL DE 1.5 ML","SOLUCION INYECTABLE","ALCON LABORATORIES INC.","FABRICANTE","IMPORTAR Y VENDER",,"13010","30357"
"30620","MAXITROL® SUSPENSION OFTALMICA ESTÉRIL","NOVARTIS PHARMA AG","INVIMA 2008M-001074-R3","1999-03-07","2099-01-01","Vigente","30620","1","5","CAJA DE CARTON PVP MÁS UN FRASCO GOTERO DE PEBD Y TAPA DE POLIPROPILENO POR 5 ML.","Activo","2006-11-10",,"No","ml","S01AA20","ANTIBIOTICOS EN COMBINACION CON OTROS F RMACOS","CONJUNTIVAL","C","DEXAMETASONA","No","1","ML DE SUSPENSIÓN OFTÁLMICA ESTÉRIL","SUSPENSION OFTALMICA","NOVARTIS DE COLOMBIA S.A.","IMPORTADOR","IMPORTAR Y VENDER",,"9685","22429"
"32869","VIREX® UNGÜENTO OFTÁLMICO ESTÉRIL","EUROFARMA COLOMBIA S.A.S.","INVIMA 2021 M-010494-R3","1999-05-29",,"Vigente","32869","1","1","CAJA PLEGABLE CARTULINA TUBO COLAPSIBLE ALUMINIO POR 10 G","Activo","2006-11-10",,"No","U","S01AD03","ACICLOVIR","TÓPICA OCULAR","D","ACICLOVIR","No","3","CADA 100G","UNGUENTO OFTALMICO","ARBOFARMA S.A.S.","FABRICANTE","FABRICAR Y VENDER",,"5397","9175"
"16436","DESFERAL® 0.5 G VIAL","NOVARTIS PHARMA A.G.","INVIMA 2023M-06069-R4","1999-12-25",,"Vigente","16436","1","10","CAJA POR 10 VIALES VIAL DE VIDRIO TIPO 1 DE 7.5ML CON TAPÓN DE BROMOBUTILO GRIS Y BROMOBUTILO SILICONIZADO GRIS CLARO SELLADO CON AGRAFE DE ALUMINIO Y TAPA PLASTICA. CON 500MG DE SUSTANCIASIN DATOSECA.","Activo","2006-11-10",,"No","U","V03AC01","DEFEROXAMINA","PARENTERAL","A","DEFEROXAMINA METANOSULFONATO","No","500","VIAL","POLVO LIOFILIZADO PARA RECONSTITUIR A SOLUCION INYECTABLE","NOVARTIS DE COLOMBIA S.A.","IMPORTADOR","IMPORTAR Y VENDER",,"12304","28710"
"22501","AGUA ESTÉRIL","LABORATORIOS MEDIFARMA S.A.S","INVIMA 2019M-007522-R3","1996-08-09",,"Vigente","22501","5","50","AMPOLLA DE POLIETILENO ATOXICO DE BAJA DENSIDAD POR 10 ML EN CAJA DE CARTÓN LISA POR 50 UNIDADES","Activo","2007-01-26","2019-12-09","No","U","V07ABX1","AGUA ESTERIL","PARENTERAL","C","AGUA GRADO INYECTABLE U.S.P. C.S.P.","No","100","100 ML","LIQUIDO ESTERIL PARA INYECCION (AGUA)","LABORATORIOS MEDIFARMA S.A.S.","FABRICANTE","FABRICAR Y VENDER",,"4982","8469"
